{
  "repo": ".claude-prime",
  "coordinator_root_path": ".",
  "lesson_key": "a3f9c2e1b4d8f6a7",
  "title": "Scoped commits must stage only executor-owned files",
  "scope": "universal",
  "body": "When dispatching executors on shared working trees, blanket `git add -A` silently absorbs sibling session changes. Always stage explicit paths via `git add -- <paths>` to prevent cross-session commit contamination.",
  "promotion_state": "pending",
  "parse_status": "ok",
  "provenance": {
    "source_kind": "coordinator_artifact",
    "repo": ".claude-prime",
    "ref": { "branch": "work/machine-b/2026-06-17to22", "sha": "647732fa" },
    "path": "state/lessons.md",
    "observed_at": "2026-06-22T08:00:00Z",
    "derivation": "parsed"
  },
  "change_kind": "doc",
  "target_wiki": "docs/wiki/scoped-safety-commits.md",
  "from_repo": "claude-central-em",
  "evidence": "SC-DR-014 hook block-blanket-git-add.sh added after recurring pattern observed",
  "created": "2026-06-15T12:00:00Z"
}
